{"acquisition_id":"official-mnq-202609-5m-inventory-20260622-20260724-v3","cohort_id":"mnq-202609-5m-v1","evidence_files":[{"byte_length":19506,"path":"NinjaTrader.Config.xml","role":"ninjatrader_config","sha256":"f5fcd60fd68a9efe7d1f84f71857ba2679d82f525cca363050e5fd726f7cca3a"},{"byte_length":2101,"path":"ninjatrader_log.txt","role":"ninjatrader_log","sha256":"313d2ac05415c9a81d4f43e9313af26d493999832ff0bc2c1670a83ff7c51e1f"},{"byte_length":19736,"path":"ninjatrader_trace.txt","role":"ninjatrader_trace","sha256":"7d26ad6e303e27cd4ee618d5df0237d857c736c3a56dfebf5beac69f9e45ec59"},{"byte_length":59531,"path":"trading_hours_template.xml","role":"trading_hours_template","sha256":"370b17f23eeea694e686394b5fdb9b55681089c22d5232d5e6a354a314325620"}],"expected_toolset_checkpoint":"a6c368a581d2a92ae681f41f78587a6349fc047f","historical_trigger":{"instrument":"MNQ SEP26","observed_at":"2026-10-07T16:01:48.635000+08:00","provider_request_period":"1 Minute","qualifying_request_count":1,"requested_end":"2026-07-27T00:00:00","requested_start":"2026-06-17T00:00:00","source_role":"ninjatrader_trace"},"intended_connection_name":"My NinjaTrader","intended_provider":{"historical_service":"NinjaTrader HDS","provider_profile_id":"NINJATRADER_TRADOVATE_PROVIDER31_HDS_V1","runtime_provider_id":"Provider31","trace_adapter":"Tradovate.Adapter"},"lifecycle":{"adapter_connection_initiated_at":"2026-10-07T16:00:22.736000+08:00","connection_ready_at":"2026-10-07T16:00:25.667000+08:00","inventory_scan_armed_at":"2026-10-07T16:21:45.8815272+08:00","inventory_scan_completed_at":"2026-10-07T16:21:46.1959562+08:00","post_request_initialized_at":"2026-10-07T16:01:50.2564337+08:00","post_request_realtime_at":"2026-10-07T16:01:50.2564337+08:00","pre_request_realtime_at":"2026-10-07T16:01:36.9859658+08:00","request_observed_at":"2026-10-07T16:01:48.635000+08:00"},"schema_version":"1.0","transformations":{"back_adjusted":false,"filled":false,"interpolated":false,"resampled":false,"sorted":false,"timezone_converted":false}}
